<?xml version="1.0"?>
<sql-rodeo xmlns:xsi="http://www.w3.org/2001/XMLSchema-instance"
	xmlns="http://www.example.org/SqlRodeoSchema" xsi:schemaLocation="http://www.example.org/SqlRodeoSchema SqlRodeoSchema.xsd">


	<!-- Versions 1.0.x -->
	<include if="schema_version.lessThan('1.0.0')" href="1.0.x/1.0.0/rodeo.xml" />
	<include if="schema_version.lessThan('1.0.1')" href="1.0.x/1.0.1/rodeo.xml" />
	<include if="schema_version.lessThan('1.0.2')" href="1.0.x/1.0.2/rodeo.xml" />
	<include if="schema_version.lessThan('1.0.3')" href="1.0.x/1.0.3/rodeo.xml" />

	<!-- Versions 1.1.x -->
	<include if="schema_version.lessThan('1.1.0')" href="1.1.x/1.1.0/rodeo.xml" />
	<include if="schema_version.lessThan('1.1.1')" href="1.1.x/1.1.1/rodeo.xml" />
	<include if="schema_version.lessThan('1.1.2')" href="1.1.x/1.1.2/rodeo.xml" />
	<include if="schema_version.lessThan('1.1.3')" href="1.1.x/1.1.3/rodeo.xml" />

</sql-rodeo>